Reading OpenROAD database at '/Users/refikyalcin/vlsi/digital/Tiny-PLL/openlane/runs/RUN_2025-12-17_14-52-26/38-openroad-globalrouting/pll_top.odb'…
Reading library file at '/Users/refikyalcin/.ciel/ciel/sky130/versions/0fe599b2afb6708d281543108caf8310912f54af/sky130A/libs.ref/sky130_fd_sc_hd/lib/sky130_fd_sc_hd__tt_025C_1v80.lib'…
Reading design constraints file at '/nix/store/7x1qis8my0i44w1lx1yq2wiwh6yc774i-python3-3.11.9-env/lib/python3.11/site-packages/librelane/scripts/base.sdc'…
[INFO] Using clock sys_clk…
[INFO] Setting output delay to: 2.0
[INFO] Setting input delay to: 2.0
[INFO] Setting load to: 0.033442
[INFO] Setting clock uncertainty to: 0.25
[INFO] Setting clock transition to: 0.1499999999999999944488848768742172978818416595458984375
[INFO] Setting timing derate to: 5%
[INFO] Setting signal min routing layer to: met1 and clock min routing layer to met1. 
[INFO] Setting signal max routing layer to: met5 and clock max routing layer to met5. 
-congestion_iterations 50 -verbose
[INFO GRT-0020] Min routing layer: met1
[INFO GRT-0021] Max routing layer: met5
[INFO GRT-0022] Global adjustment: 30%
[INFO GRT-0023] Grid origin: (0, 0)
[INFO GRT-0043] No OR_DEFAULT vias defined.
[INFO GRT-0088] Layer li1     Track-Pitch = 0.4600  line-2-Via Pitch: 0.3400
[INFO GRT-0088] Layer met1    Track-Pitch = 0.3400  line-2-Via Pitch: 0.3400
[INFO GRT-0088] Layer met2    Track-Pitch = 0.4600  line-2-Via Pitch: 0.3500
[INFO GRT-0088] Layer met3    Track-Pitch = 0.6800  line-2-Via Pitch: 0.6150
[INFO GRT-0088] Layer met4    Track-Pitch = 0.9200  line-2-Via Pitch: 1.0400
[INFO GRT-0088] Layer met5    Track-Pitch = 3.4000  line-2-Via Pitch: 3.1100
[INFO GRT-0019] Found 18 clock nets.
[INFO GRT-0001] Minimum degree: 2
[INFO GRT-0002] Maximum degree: 17
[INFO GRT-0003] Macros: 0
[INFO GRT-0043] No OR_DEFAULT vias defined.
[INFO GRT-0004] Blockages: 2236

[INFO GRT-0053] Routing resources analysis:
          Routing      Original      Derated      Resource
Layer     Direction    Resources     Resources    Reduction (%)
---------------------------------------------------------------
li1        Vertical            0             0          0.00%
met1       Horizontal      13610          6632          51.27%
met2       Vertical        10452          6669          36.19%
met3       Horizontal       6805          4456          34.52%
met4       Vertical         4251          2058          51.59%
met5       Horizontal       1346           552          58.99%
---------------------------------------------------------------

[INFO GRT-0101] Running extra iterations to remove overflow.
[INFO GRT-0197] Via related to pin nodes: 7662
[INFO GRT-0198] Via related Steiner nodes: 97
[INFO GRT-0199] Via filling finished.
[INFO GRT-0111] Final number of vias: 9412
[INFO GRT-0112] Final usage 3D: 32195

[INFO GRT-0096] Final congestion report:
Layer         Resource        Demand        Usage (%)    Max H / Max V / Total Overflow
---------------------------------------------------------------------------------------
li1                  0             0            0.00%             0 /  0 /  0
met1              6632          1886           28.44%             0 /  0 /  0
met2              6669          2035           30.51%             0 /  0 /  0
met3              4456            31            0.70%             0 /  0 /  0
met4              2058             7            0.34%             0 /  0 /  0
met5               552             0            0.00%             0 /  0 /  0
---------------------------------------------------------------------------------------
Total            20367          3959           19.44%             0 /  0 /  0

[INFO GRT-0018] Total wirelength: 47761 um
[INFO GRT-0014] Routed nets: 1610
[INFO GRT-0006] Repairing antennas, iteration 1.
[INFO GRT-0043] No OR_DEFAULT vias defined.
[INFO GRT-0012] Found 0 antenna violations.
Placement Analysis
---------------------------------
total displacement          0.0 u
average displacement        0.0 u
max displacement            0.0 u
original HPWL           25928.5 u
legalized HPWL          26961.9 u
delta HPWL                    4 %

[INFO DPL-0020] Mirrored 675 instances
[INFO DPL-0021] HPWL before           26961.9 u
[INFO DPL-0022] HPWL after            25928.5 u
[INFO DPL-0023] HPWL delta               -3.8 %
-congestion_iterations 50 -verbose
[INFO GRT-0020] Min routing layer: met1
[INFO GRT-0021] Max routing layer: met5
[INFO GRT-0022] Global adjustment: 30%
[INFO GRT-0023] Grid origin: (0, 0)
[INFO GRT-0043] No OR_DEFAULT vias defined.
[INFO GRT-0088] Layer li1     Track-Pitch = 0.4600  line-2-Via Pitch: 0.3400
[INFO GRT-0088] Layer met1    Track-Pitch = 0.3400  line-2-Via Pitch: 0.3400
[INFO GRT-0088] Layer met2    Track-Pitch = 0.4600  line-2-Via Pitch: 0.3500
[INFO GRT-0088] Layer met3    Track-Pitch = 0.6800  line-2-Via Pitch: 0.6150
[INFO GRT-0088] Layer met4    Track-Pitch = 0.9200  line-2-Via Pitch: 1.0400
[INFO GRT-0088] Layer met5    Track-Pitch = 3.4000  line-2-Via Pitch: 3.1100
[INFO GRT-0019] Found 18 clock nets.
[INFO GRT-0001] Minimum degree: 2
[INFO GRT-0002] Maximum degree: 17
[INFO GRT-0003] Macros: 0
[INFO GRT-0043] No OR_DEFAULT vias defined.
[INFO GRT-0004] Blockages: 2236

[INFO GRT-0053] Routing resources analysis:
          Routing      Original      Derated      Resource
Layer     Direction    Resources     Resources    Reduction (%)
---------------------------------------------------------------
li1        Vertical            0             0          0.00%
met1       Horizontal      13610          6632          51.27%
met2       Vertical        10452          6669          36.19%
met3       Horizontal       6805          4456          34.52%
met4       Vertical         4251          2058          51.59%
met5       Horizontal       1346           552          58.99%
---------------------------------------------------------------

[INFO GRT-0101] Running extra iterations to remove overflow.
[INFO GRT-0197] Via related to pin nodes: 7662
[INFO GRT-0198] Via related Steiner nodes: 97
[INFO GRT-0199] Via filling finished.
[INFO GRT-0111] Final number of vias: 9412
[INFO GRT-0112] Final usage 3D: 32195

[INFO GRT-0096] Final congestion report:
Layer         Resource        Demand        Usage (%)    Max H / Max V / Total Overflow
---------------------------------------------------------------------------------------
li1                  0             0            0.00%             0 /  0 /  0
met1              6632          1886           28.44%             0 /  0 /  0
met2              6669          2035           30.51%             0 /  0 /  0
met3              4456            31            0.70%             0 /  0 /  0
met4              2058             7            0.34%             0 /  0 /  0
met5               552             0            0.00%             0 /  0 /  0
---------------------------------------------------------------------------------------
Total            20367          3959           19.44%             0 /  0 /  0

[INFO GRT-0018] Total wirelength: 47761 um
[INFO GRT-0014] Routed nets: 1610
[INFO] Setting RC values…
Setting global connections for newly added cells…
[INFO] Setting global connections...
Updating metrics…
Cell type report:                       Count       Area
  Fill cell                               122     457.94
  Tap cell                                378     472.95
  Buffer                                    1       3.75
  Clock buffer                             17     245.24
  Timing Repair Buffer                    340    2061.98
  Inverter                                 27     101.35
  Clock inverter                           15     212.70
  Sequential cell                         154    3116.74
  Multi-Input combinational cell         1004    7055.52
  Total                                  2058   13728.17
Writing OpenROAD database to '/Users/refikyalcin/vlsi/digital/Tiny-PLL/openlane/runs/RUN_2025-12-17_14-52-26/41-openroad-repairantennas/1-diodeinsertion/pll_top.odb'…
Writing layout to '/Users/refikyalcin/vlsi/digital/Tiny-PLL/openlane/runs/RUN_2025-12-17_14-52-26/41-openroad-repairantennas/1-diodeinsertion/pll_top.def'…
