Reading OpenROAD database at '/Users/refikyalcin/vlsi/digital/Tiny-PLL/openlane/runs/RUN_2025-12-22_14-00-22/38-openroad-globalrouting/pll_top.odb'…
Reading library file at '/Users/refikyalcin/.ciel/ciel/sky130/versions/0fe599b2afb6708d281543108caf8310912f54af/sky130A/libs.ref/sky130_fd_sc_hd/lib/sky130_fd_sc_hd__tt_025C_1v80.lib'…
Reading design constraints file at '/nix/store/7x1qis8my0i44w1lx1yq2wiwh6yc774i-python3-3.11.9-env/lib/python3.11/site-packages/librelane/scripts/base.sdc'…
[INFO] Using clock sys_clk…
[INFO] Setting output delay to: 2.0
[INFO] Setting input delay to: 2.0
[INFO] Setting load to: 0.033442
[INFO] Setting clock uncertainty to: 0.25
[INFO] Setting clock transition to: 0.1499999999999999944488848768742172978818416595458984375
[INFO] Setting timing derate to: 5%
[INFO] Setting signal min routing layer to: met1 and clock min routing layer to met1. 
[INFO] Setting signal max routing layer to: met5 and clock max routing layer to met5. 
-congestion_iterations 50 -verbose
[INFO GRT-0020] Min routing layer: met1
[INFO GRT-0021] Max routing layer: met5
[INFO GRT-0022] Global adjustment: 30%
[INFO GRT-0023] Grid origin: (0, 0)
[INFO GRT-0043] No OR_DEFAULT vias defined.
[INFO GRT-0088] Layer li1     Track-Pitch = 0.4600  line-2-Via Pitch: 0.3400
[INFO GRT-0088] Layer met1    Track-Pitch = 0.3400  line-2-Via Pitch: 0.3400
[INFO GRT-0088] Layer met2    Track-Pitch = 0.4600  line-2-Via Pitch: 0.3500
[INFO GRT-0088] Layer met3    Track-Pitch = 0.6800  line-2-Via Pitch: 0.6150
[INFO GRT-0088] Layer met4    Track-Pitch = 0.9200  line-2-Via Pitch: 1.0400
[INFO GRT-0088] Layer met5    Track-Pitch = 3.4000  line-2-Via Pitch: 3.1100
[INFO GRT-0019] Found 18 clock nets.
[INFO GRT-0001] Minimum degree: 2
[INFO GRT-0002] Maximum degree: 17
[INFO GRT-0003] Macros: 0
[INFO GRT-0043] No OR_DEFAULT vias defined.
[INFO GRT-0004] Blockages: 2256

[INFO GRT-0053] Routing resources analysis:
          Routing      Original      Derated      Resource
Layer     Direction    Resources     Resources    Reduction (%)
---------------------------------------------------------------
li1        Vertical            0             0          0.00%
met1       Horizontal      13710          6694          51.17%
met2       Vertical        10533          6721          36.19%
met3       Horizontal       6855          4480          34.65%
met4       Vertical         4278          2058          51.89%
met5       Horizontal       1371           576          57.99%
---------------------------------------------------------------

[INFO GRT-0197] Via related to pin nodes: 7551
[INFO GRT-0198] Via related Steiner nodes: 103
[INFO GRT-0199] Via filling finished.
[INFO GRT-0111] Final number of vias: 9227
[INFO GRT-0112] Final usage 3D: 31589

[INFO GRT-0096] Final congestion report:
Layer         Resource        Demand        Usage (%)    Max H / Max V / Total Overflow
---------------------------------------------------------------------------------------
li1                  0             0            0.00%             0 /  0 /  0
met1              6694          1907           28.49%             0 /  0 /  0
met2              6721          1944           28.92%             0 /  0 /  0
met3              4480            57            1.27%             0 /  0 /  0
met4              2058             0            0.00%             0 /  0 /  0
met5               576             0            0.00%             0 /  0 /  0
---------------------------------------------------------------------------------------
Total            20529          3908           19.04%             0 /  0 /  0

[INFO GRT-0018] Total wirelength: 46885 um
[INFO GRT-0014] Routed nets: 1522
[INFO GRT-0006] Repairing antennas, iteration 1.
[INFO GRT-0043] No OR_DEFAULT vias defined.
[INFO GRT-0012] Found 1 antenna violations.
[INFO GRT-0015] Inserted 1 diodes.
[INFO GRT-0009] rerouting 435 nets.
[INFO GRT-0001] Minimum degree: 2
[INFO GRT-0002] Maximum degree: 17
[INFO GRT-0006] Repairing antennas, iteration 2.
[INFO GRT-0043] No OR_DEFAULT vias defined.
[INFO GRT-0012] Found 0 antenna violations.
Placement Analysis
---------------------------------
total displacement          0.0 u
average displacement        0.0 u
max displacement            0.0 u
original HPWL           26062.0 u
legalized HPWL          26062.0 u
delta HPWL                    0 %

[INFO DPL-0020] Mirrored 695 instances
[INFO DPL-0021] HPWL before           26062.0 u
[INFO DPL-0022] HPWL after            24736.3 u
[INFO DPL-0023] HPWL delta               -5.1 %
-congestion_iterations 50 -verbose
[INFO GRT-0020] Min routing layer: met1
[INFO GRT-0021] Max routing layer: met5
[INFO GRT-0022] Global adjustment: 30%
[INFO GRT-0023] Grid origin: (0, 0)
[INFO GRT-0043] No OR_DEFAULT vias defined.
[INFO GRT-0088] Layer li1     Track-Pitch = 0.4600  line-2-Via Pitch: 0.3400
[INFO GRT-0088] Layer met1    Track-Pitch = 0.3400  line-2-Via Pitch: 0.3400
[INFO GRT-0088] Layer met2    Track-Pitch = 0.4600  line-2-Via Pitch: 0.3500
[INFO GRT-0088] Layer met3    Track-Pitch = 0.6800  line-2-Via Pitch: 0.6150
[INFO GRT-0088] Layer met4    Track-Pitch = 0.9200  line-2-Via Pitch: 1.0400
[INFO GRT-0088] Layer met5    Track-Pitch = 3.4000  line-2-Via Pitch: 3.1100
[INFO GRT-0019] Found 18 clock nets.
[INFO GRT-0001] Minimum degree: 2
[INFO GRT-0002] Maximum degree: 17
[INFO GRT-0003] Macros: 0
[INFO GRT-0043] No OR_DEFAULT vias defined.
[INFO GRT-0004] Blockages: 2256

[INFO GRT-0053] Routing resources analysis:
          Routing      Original      Derated      Resource
Layer     Direction    Resources     Resources    Reduction (%)
---------------------------------------------------------------
li1        Vertical            0             0          0.00%
met1       Horizontal      13710          6694          51.17%
met2       Vertical        10533          6721          36.19%
met3       Horizontal       6855          4480          34.65%
met4       Vertical         4278          2058          51.89%
met5       Horizontal       1371           576          57.99%
---------------------------------------------------------------

[INFO GRT-0197] Via related to pin nodes: 7550
[INFO GRT-0198] Via related Steiner nodes: 103
[INFO GRT-0199] Via filling finished.
[INFO GRT-0111] Final number of vias: 9226
[INFO GRT-0112] Final usage 3D: 31586

[INFO GRT-0096] Final congestion report:
Layer         Resource        Demand        Usage (%)    Max H / Max V / Total Overflow
---------------------------------------------------------------------------------------
li1                  0             0            0.00%             0 /  0 /  0
met1              6694          1907           28.49%             0 /  0 /  0
met2              6721          1944           28.92%             0 /  0 /  0
met3              4480            57            1.27%             0 /  0 /  0
met4              2058             0            0.00%             0 /  0 /  0
met5               576             0            0.00%             0 /  0 /  0
---------------------------------------------------------------------------------------
Total            20529          3908           19.04%             0 /  0 /  0

[INFO GRT-0018] Total wirelength: 46885 um
[INFO GRT-0014] Routed nets: 1522
[INFO] Setting RC values…
Setting global connections for newly added cells…
[INFO] Setting global connections...
Updating metrics…
Cell type report:                       Count       Area
  Fill cell                               122     457.94
  Tap cell                                378     472.95
  Antenna cell                              1       2.50
  Buffer                                    1       3.75
  Clock buffer                             22     307.80
  Timing Repair Buffer                    233    1640.32
  Inverter                                 28     105.10
  Clock inverter                           10     141.39
  Sequential cell                         154    3092.97
  Multi-Input combinational cell         1022    7438.38
  Total                                  1971   13663.10
Writing OpenROAD database to '/Users/refikyalcin/vlsi/digital/Tiny-PLL/openlane/runs/RUN_2025-12-22_14-00-22/41-openroad-repairantennas/1-diodeinsertion/pll_top.odb'…
Writing layout to '/Users/refikyalcin/vlsi/digital/Tiny-PLL/openlane/runs/RUN_2025-12-22_14-00-22/41-openroad-repairantennas/1-diodeinsertion/pll_top.def'…
